[
  {
    "id": "rust-ownership-001",
    "course": "rust",
    "topic": "ownership",
    "level": "beginner",
    "type": "concept",
    "concept": "Ownership — система управления памятью Rust без GC. Каждое значение имеет ровно одного владельца. Когда владелец выходит из области видимости, значение уничтожается.",
    "question": "Что такое ownership в Rust?",
    "explanation": "Ownership — это набор правил, которым следует компилятор для управления памятью. Три правила: 1) у каждого значения есть владелец; 2) владелец только один; 3) когда владелец выходит из области видимости — значение дропается. Это позволяет Rust гарантировать memory safety без garbage collector."
  },
  {
    "id": "rust-ownership-002",
    "course": "rust",
    "topic": "ownership",
    "level": "beginner",
    "type": "compiles",
    "concept": "При присвоении переменной, содержащей heap-данные (String), происходит move — исходная переменная становится недействительной.",
    "code": "fn main() {\n    let s1 = String::from(\"hello\");\n    let s2 = s1;\n    println!(\"{}\", s1);\n}",
    "question": "Скомпилируется ли этот код?",
    "options": ["Да", "Нет"],
    "answer": 1,
    "expected": "fails",
    "explanation": "Нет. После `let s2 = s1` владение String переходит к s2. Попытка использовать s1 после move вызывает: `error[E0382]: borrow of moved value: `s1``. Чтобы исправить, нужен s1.clone()."
  },
  {
    "id": "rust-ownership-003",
    "course": "rust",
    "topic": "ownership",
    "level": "beginner",
    "type": "compiles",
    "concept": "Типы с трейтом Copy (i32, f64, bool, char) при присвоении копируются, а не перемещаются. Исходная переменная остаётся действительной.",
    "code": "fn main() {\n    let x = 5;\n    let y = x;\n    println!(\"{} {}\", x, y);\n}",
    "question": "Скомпилируется ли этот код?",
    "options": ["Да", "Нет"],
    "answer": 0,
    "expected": "compiles",
    "explanation": "Да. i32 реализует трейт Copy, поэтому `let y = x` создаёт копию значения. Оба x и y независимы и доступны. Stack-данные (числа, bool, char) копируются автоматически."
  },
  {
    "id": "rust-ownership-004",
    "course": "rust",
    "topic": "ownership",
    "level": "beginner",
    "type": "compiles",
    "concept": "Передача значения в функцию — это тоже move для heap-типов. После вызова исходная переменная недоступна.",
    "code": "fn take(s: String) { println!(\"{}\", s); }\nfn main() {\n    let s = String::from(\"hi\");\n    take(s);\n    println!(\"{}\", s);\n}",
    "question": "Скомпилируется ли этот код?",
    "options": ["Да", "Нет"],
    "answer": 1,
    "expected": "fails",
    "explanation": "Нет. Вызов `take(s)` перемещает s в функцию. После возврата s больше недействителен. Ошибка: `error[E0382]: use of moved value: `s``. Решение: вернуть String из функции или использовать &String."
  },
  {
    "id": "rust-ownership-005",
    "course": "rust",
    "topic": "ownership",
    "level": "beginner",
    "type": "output",
    "concept": "Функция может вернуть владение, передав значение обратно через return. Владение следует возвращаемому значению.",
    "code": "fn give() -> String {\n    String::from(\"hello\")\n}\nfn main() {\n    let s = give();\n    println!(\"{}\", s);\n}",
    "question": "Что выведет программа?",
    "options": ["hello", "Ошибка компиляции", "", "give()"],
    "answer": 0,
    "expected_output": "hello",
    "explanation": "Функция give() создаёт String и передаёт владение вызывающему через return. s получает владение строкой. Программа выводит: hello."
  },
  {
    "id": "rust-ownership-006",
    "course": "rust",
    "topic": "ownership",
    "level": "intermediate",
    "type": "compiles",
    "concept": "Drop вызывается автоматически при выходе значения из области видимости. Явный вызов drop(x) перемещает значение и дропает его немедленно.",
    "code": "fn main() {\n    let s = String::from(\"hello\");\n    drop(s);\n    println!(\"{}\", s);\n}",
    "question": "Скомпилируется ли этот код?",
    "options": ["Да", "Нет"],
    "answer": 1,
    "expected": "fails",
    "explanation": "Нет. `drop(s)` принимает s по значению (move) и немедленно уничтожает его. После drop(s) переменная s недействительна. Ошибка: `error[E0382]: use of moved value: `s``."
  },
  {
    "id": "rust-ownership-007",
    "course": "rust",
    "topic": "ownership",
    "level": "intermediate",
    "type": "output",
    "concept": "Переменные уничтожаются в обратном порядке объявления (LIFO). Трейт Drop позволяет выполнить код при уничтожении.",
    "code": "struct D(&'static str);\nimpl Drop for D {\n    fn drop(&mut self) {\n        println!(\"drop {}\", self.0);\n    }\n}\nfn main() {\n    let _a = D(\"a\");\n    let _b = D(\"b\");\n}",
    "question": "Что выведет программа?",
    "options": ["drop a\ndrop b", "drop b\ndrop a", "drop a", "drop b"],
    "answer": 1,
    "expected_output": "drop b\ndrop a",
    "explanation": "Переменные уничтожаются в порядке LIFO. _b объявлен после _a, поэтому drop(_b) вызывается раньше. Вывод: drop b, затем drop a."
  },
  {
    "id": "rust-ownership-008",
    "course": "rust",
    "topic": "ownership",
    "level": "intermediate",
    "type": "choice",
    "concept": "Clone создаёт глубокую копию heap-данных. В отличие от Copy (который происходит неявно для stack-данных), clone() явный и может быть медленным.",
    "question": "Какой метод создаёт глубокую копию String в Rust?",
    "options": ["copy()", "clone()", "dup()", "deep_copy()"],
    "answer": 1,
    "explanation": "clone() — стандартный метод трейта Clone для создания полной независимой копии. Для String он выделяет новую область памяти и копирует содержимое. copy() и dup() не существуют, deep_copy() тоже."
  },
  {
    "id": "rust-ownership-009",
    "course": "rust",
    "topic": "ownership",
    "level": "advanced",
    "type": "compiles",
    "concept": "Деструктуризация struct также перемещает поля. После частичного перемещения структура не может использоваться целиком.",
    "code": "struct Pair { a: String, b: String }\nfn main() {\n    let p = Pair {\n        a: String::from(\"x\"),\n        b: String::from(\"y\"),\n    };\n    let a = p.a;\n    println!(\"{}\", p.b);\n}",
    "question": "Скомпилируется ли этот код?",
    "options": ["Да", "Нет"],
    "answer": 0,
    "expected": "compiles",
    "explanation": "Да. После `let a = p.a` поле p.a перемещено, но p.b остаётся действительным. Обращение к p.b напрямую — корректно. Ошибка была бы только при использовании p целиком после частичного move."
  },
  {
    "id": "rust-ownership-010",
    "course": "rust",
    "topic": "ownership",
    "level": "advanced",
    "type": "fill",
    "concept": "Rc<T> позволяет иметь нескольких владельцев через подсчёт ссылок. Используется для shared ownership в однопоточном контексте.",
    "question": "Для shared ownership в однопоточном коде Rust используют ___<T>.",
    "options": ["Box", "Rc", "Arc", "Cell"],
    "answer": 1,
    "explanation": "Rc<T> (Reference Counted) — умный указатель с подсчётом ссылок для однопоточного shared ownership. Arc<T> — аналог для многопоточного кода. Box<T> — единственный владелец в heap. Cell<T> — interior mutability."
  }
]
