[
  {
    "id": "crypto-hashing-001",
    "course": "crypto",
    "topic": "hashing",
    "level": "beginner",
    "type": "concept",
    "concept": "A hash function maps input data of arbitrary length to a fixed-size output. A cryptographic hash function is additionally resistant to precomputation and collisions.",
    "question": "What properties does a cryptographic hash function have?",
    "explanation": "A cryptographic hash function is: 1) Deterministic — identical inputs produce identical outputs; 2) Preimage resistant — the input cannot be recovered from the hash; 3) Collision resistant — it is hard to find two inputs with the same output; 4) Exhibits the avalanche effect — a 1-bit change in the input changes about 50% of the output bits."
  },
  {
    "id": "crypto-hashing-002",
    "course": "crypto",
    "topic": "hashing",
    "level": "beginner",
    "type": "choice",
    "concept": "SHA-256 outputs 256 bits (32 bytes) regardless of the input. It is used in Bitcoin, TLS, and x.509. The output is commonly written as 64 hex characters.",
    "question": "How many bytes are in a SHA-256 output?",
    "options": ["16", "20", "32", "64"],
    "answer": 2,
    "explanation": "SHA-256 produces 256 bits = 32 bytes. In hex representation that is 64 characters (4 bits per character). MD5 is 128 bits/16 bytes, SHA-1 is 160 bits/20 bytes, and SHA-512 is 512 bits/64 bytes."
  },
  {
    "id": "crypto-hashing-003",
    "course": "crypto",
    "topic": "hashing",
    "level": "beginner",
    "type": "concept",
    "concept": "A salt is random data added to a password before hashing. It protects against rainbow tables and ensures that identical passwords produce different hashes.",
    "question": "Why add a salt when hashing passwords?",
    "explanation": "A salt is unique random data for each password. It protects against: 1) rainbow tables — precomputed hashes; 2) identical passwords (hash(password + salt1) != hash(password + salt2)). The salt is stored in the clear alongside the hash."
  },
  {
    "id": "crypto-hashing-004",
    "course": "crypto",
    "topic": "hashing",
    "level": "intermediate",
    "type": "choice",
    "concept": "bcrypt, scrypt, and Argon2 are password-hashing algorithms. They are intentionally slow (computationally expensive) to protect against brute-force attacks.",
    "question": "Why shouldn't you use SHA-256 to store passwords?",
    "options": ["It doesn't support salt", "It is too slow", "It is too fast", "It is not secure"],
    "answer": 2,
    "explanation": "SHA-256 is too fast: a GPU can compute billions of SHA-256 hashes per second. Bcrypt/Argon2 have a tunable work factor that makes brute-forcing practically impossible. bcrypt also embeds the salt."
  },
  {
    "id": "crypto-hashing-005",
    "course": "crypto",
    "topic": "hashing",
    "level": "intermediate",
    "type": "choice",
    "concept": "HMAC (Hash-based Message Authentication Code) is a mechanism for verifying message integrity using a secret key. HMAC = hash(key || message || key).",
    "question": "What does HMAC guarantee?",
    "options": ["Message encryption", "Integrity and authenticity", "Anonymity", "Compression"],
    "answer": 1,
    "explanation": "HMAC guarantees: 1) integrity — the message has not been altered; 2) authenticity — the sender knows the secret key. It does not encrypt — the data remains in the clear. It is used in JWT, TLS, and API authentication."
  },
  {
    "id": "crypto-hashing-006",
    "course": "crypto",
    "topic": "hashing",
    "level": "advanced",
    "type": "choice",
    "concept": "Length extension attack: an attack on hash functions of the Merkle-Damgård family (MD5, SHA-1, SHA-256). An attacker can append data without knowing the key, given the intermediate hash.",
    "question": "Which hash function is resistant to a length extension attack?",
    "options": ["SHA-256", "SHA-1", "SHA-3 (Keccak)", "MD5"],
    "answer": 2,
    "explanation": "SHA-3 (Keccak) uses a sponge construction rather than Merkle-Damgård. The latter is vulnerable to length extension: the internal state of the hash = IV + data. That is why HMAC-SHA256 or SHA-3 is recommended for HMAC."
  }
]
