[
  {
    "id": "statistics-descriptive-001",
    "course": "statistics",
    "topic": "descriptive",
    "level": "beginner",
    "type": "concept",
    "concept": "Среднее арифметическое (mean) — сумма всех значений, делённая на их количество: μ = (x₁ + x₂ + … + xₙ) / n. Это наиболее распространённая мера центральной тенденции.",
    "question": "Что такое среднее арифметическое и в чём его главный недостаток?",
    "explanation": "Mean чувствителен к выбросам: одно аномальное значение существенно смещает результат. Поэтому для скошенных распределений (доходы, цены на недвижимость) предпочтительна медиана — она не зависит от экстремальных значений."
  },
  {
    "id": "statistics-descriptive-002",
    "course": "statistics",
    "topic": "descriptive",
    "level": "beginner",
    "type": "choice",
    "concept": "Медиана — значение, которое делит упорядоченный ряд пополам. При чётном числе элементов медиана равна среднему двух центральных значений.",
    "question": "Найди медиану ряда [3, 1, 4, 1, 5, 9, 2, 6].",
    "options": ["3", "3.5", "4", "2.5"],
    "answer": 1,
    "explanation": "Сортируем: [1, 1, 2, 3, 4, 5, 6, 9]. Восемь элементов — чётное число. Медиана = (3 + 4) / 2 = 3.5. Медиана не зависит от крайних значений, поэтому устойчива к выбросам в отличие от среднего."
  },
  {
    "id": "statistics-descriptive-003",
    "course": "statistics",
    "topic": "descriptive",
    "level": "beginner",
    "type": "concept",
    "concept": "Дисперсия (variance) измеряет средний квадрат отклонения значений от среднего. Генеральная: σ² = Σ(xᵢ - μ)² / n. Выборочная с поправкой Бесселя: s² = Σ(xᵢ - x̄)² / (n-1).",
    "question": "В чём разница между выборочной и генеральной дисперсией?",
    "explanation": "Поправка Бесселя (деление на n-1 вместо n) нужна потому, что x̄ уже «использовало» одну степень свободы данных. Без неё выборочная дисперсия систематически занижает истинную σ². При больших n разница несущественна."
  },
  {
    "id": "statistics-descriptive-004",
    "course": "statistics",
    "topic": "descriptive",
    "level": "beginner",
    "type": "fill",
    "concept": "Выборочная дисперсия использует поправку Бесселя для получения несмещённой оценки дисперсии генеральной совокупности.",
    "question": "Выборочная дисперсия: s² = Σ(xᵢ - x̄)² / ___",
    "options": ["n", "n-1", "n+1", "2n"],
    "answer": 1,
    "explanation": "Делим на n-1, потому что оцениваем μ через x̄ — это стоит одну степень свободы. Деление на n даёт смещённую оценку, которая систематически оказывается меньше истинной σ². При n→∞ разница исчезает."
  },
  {
    "id": "statistics-descriptive-005",
    "course": "statistics",
    "topic": "descriptive",
    "level": "beginner",
    "type": "output",
    "concept": "В Python среднее вычисляется через sum() / len(). Оператор деления / всегда возвращает float.",
    "code": "data = [2, 4, 4, 4, 5, 5, 7, 9]\nmean = sum(data) / len(data)\nprint(mean)",
    "question": "Что выведет программа?",
    "options": ["4.5", "5.0", "4.0", "5.5"],
    "answer": 1,
    "expected_output": "5.0",
    "explanation": "Сумма: 2+4+4+4+5+5+7+9 = 40. Количество: 8. Mean = 40 / 8 = 5.0. Python выводит 5.0 (float), а не 5 (int), потому что / — всегда деление с плавающей точкой. Используй // для целочисленного деления."
  },
  {
    "id": "statistics-descriptive-006",
    "course": "statistics",
    "topic": "descriptive",
    "level": "beginner",
    "type": "choice",
    "concept": "Мода (mode) — наиболее часто встречающееся значение. Набор может быть унимодальным, бимодальным или не иметь моды совсем.",
    "question": "Какова мода ряда [1, 2, 2, 3, 3, 3, 4, 4]?",
    "options": ["2", "3", "4", "2 и 3"],
    "answer": 1,
    "explanation": "Значение 3 встречается трижды — чаще остальных (1 — один раз, 2 — два раза, 4 — два раза). Ряд унимодален. Мода — единственная мера центральной тенденции, применимая к номинальным данным (например, к наиболее популярному цвету)."
  },
  {
    "id": "statistics-descriptive-007",
    "course": "statistics",
    "topic": "descriptive",
    "level": "beginner",
    "type": "concept",
    "concept": "Стандартное отклонение (σ или s) — квадратный корень из дисперсии. Выражается в тех же единицах, что и исходные данные, в отличие от дисперсии.",
    "question": "Почему стандартное отклонение удобнее дисперсии для интерпретации?",
    "explanation": "Дисперсия измеряется в квадратных единицах (если данные в см, дисперсия в см²), что неинтуитивно. Стандартное отклонение возвращается к исходным единицам: σ=5 см означает, что типичное отклонение от среднего составляет 5 см. Это делает его удобным для сравнения с самими данными."
  },
  {
    "id": "statistics-descriptive-008",
    "course": "statistics",
    "topic": "descriptive",
    "level": "beginner",
    "type": "choice",
    "concept": "Межквартильный размах (IQR) = Q3 - Q1. Охватывает центральные 50% данных и устойчив к выбросам, в отличие от полного размаха (Max - Min).",
    "question": "Как вычислить межквартильный размах (IQR)?",
    "options": ["Q2 - Q1", "Q3 - Q1", "Q3 - Q2", "Max - Min"],
    "answer": 1,
    "explanation": "IQR = Q3 - Q1, где Q3 = P75, Q1 = P25. IQR используется для обнаружения выбросов: значения за пределами [Q1 - 1.5·IQR, Q3 + 1.5·IQR] считаются потенциальными выбросами (правило Тьюки). Размах (Max-Min) крайне чувствителен к одному выбросу."
  },
  {
    "id": "statistics-descriptive-009",
    "course": "statistics",
    "topic": "descriptive",
    "level": "intermediate",
    "type": "fill",
    "concept": "Z-оценка (z-score) показывает, на сколько стандартных отклонений значение отличается от среднего. Используется для стандартизации данных из разных распределений.",
    "question": "Формула z-оценки: z = (x - μ) / ___",
    "options": ["σ", "σ²", "n", "√n"],
    "answer": 0,
    "explanation": "Делим на σ (стандартное отклонение), не на дисперсию σ². Это переводит значение в единицы стандартных отклонений: z=2 означает, что x на 2σ выше среднего. Стандартизованные данные имеют mean=0 и σ=1, что позволяет сравнивать величины из разных шкал."
  },
  {
    "id": "statistics-descriptive-010",
    "course": "statistics",
    "topic": "descriptive",
    "level": "intermediate",
    "type": "concept",
    "concept": "Асимметрия (skewness) характеризует несимметричность распределения. Положительная (правосторонняя): длинный правый хвост, mean > median. Отрицательная (левосторонняя): длинный левый хвост, mean < median.",
    "question": "Как соотносятся mean и median при положительной асимметрии?",
    "explanation": "При правостороннем скосе редкие большие значения «тянут» среднее вправо (mean > median). Классический пример — распределение доходов: большинство зарабатывает около медианы, но несколько человек с огромными доходами резко поднимают среднее. Именно поэтому статистика доходов публикует медиану."
  },
  {
    "id": "statistics-descriptive-011",
    "course": "statistics",
    "topic": "descriptive",
    "level": "beginner",
    "type": "output",
    "concept": "Дисперсия генеральной совокупности: σ² = Σ(xᵢ - μ)² / n.",
    "code": "data = [2, 4, 4, 4, 5, 5, 7, 9]\nmu = 5.0\nvariance = sum((x - mu)**2 for x in data) / len(data)\nprint(variance)",
    "question": "Что выведет программа?",
    "options": ["3.5", "4.0", "4.57", "32.0"],
    "answer": 1,
    "expected_output": "4.0",
    "explanation": "Отклонения от μ=5: (-3)²=9, (-1)²=1, (-1)²=1, (-1)²=1, 0, 0, 4, 16. Сумма квадратов = 32. Делим на n=8: 32/8 = 4.0. Если бы считали выборочную дисперсию (n-1=7), получили бы 32/7 ≈ 4.57."
  },
  {
    "id": "statistics-descriptive-012",
    "course": "statistics",
    "topic": "descriptive",
    "level": "intermediate",
    "type": "choice",
    "concept": "Процентиль p — значение, ниже которого лежит p% наблюдений. Квартили: Q1=P25, Q2=P50 (медиана), Q3=P75.",
    "question": "Чему равен 50-й процентиль выборки?",
    "options": ["Среднему (mean)", "Медиане (median)", "Моде (mode)", "Q3"],
    "answer": 1,
    "explanation": "P50 = медиана: ровно 50% значений лежит ниже этой точки. Это одно из определений медианы. Q1 = P25, Q3 = P75. Среднее и медиана совпадают только для симметричных распределений; для скошенных данных P50 — более надёжная мера центра."
  }
]
