[
  {
    "id": "statistics-inference-001",
    "course": "statistics",
    "topic": "inference",
    "level": "intermediate",
    "type": "concept",
    "concept": "Центральная предельная теорема (ЦПТ): среднее достаточно большой выборки из любого распределения с конечными μ и σ² стремится к нормальному N(μ, σ²/n). Обычно достаточно n ≥ 30.",
    "question": "Что утверждает центральная предельная теорема и почему она важна?",
    "explanation": "ЦПТ объясняет повсеместность нормального распределения. x̄ ~ N(μ, σ²/n) при большом n, независимо от формы исходного распределения. Это позволяет строить доверительные интервалы и тесты, не зная точного закона распределения данных."
  },
  {
    "id": "statistics-inference-002",
    "course": "statistics",
    "topic": "inference",
    "level": "intermediate",
    "type": "choice",
    "concept": "95%-й доверительный интервал (CI) — результат процедуры, которая при многократном повторении в 95% случаев накрывает истинный параметр.",
    "question": "Что правильно описывает 95% доверительный интервал?",
    "options": [
      "Истинный параметр находится в этом интервале с вероятностью 95%",
      "95% наблюдений выборки попадают в этот интервал",
      "95% таких интервалов при повторных экспериментах накроют истинный параметр",
      "Вероятность ошибки при использовании интервала равна 5%"
    ],
    "answer": 2,
    "explanation": "Частотная интерпретация: конкретный интервал либо содержит μ, либо нет — никакой «вероятности» нет. 95% — свойство процедуры построения, а не конкретного интервала. Типичная ошибка — думать, что μ лежит внутри «с вероятностью 95%»."
  },
  {
    "id": "statistics-inference-003",
    "course": "statistics",
    "topic": "inference",
    "level": "beginner",
    "type": "concept",
    "concept": "Нулевая гипотеза H₀ — утверждение об отсутствии эффекта (статус-кво). Альтернативная H₁ — то, что мы хотим доказать. Тест решает: есть ли достаточно доказательств, чтобы отвергнуть H₀.",
    "question": "В чём разница между нулевой и альтернативной гипотезами?",
    "explanation": "H₀ отвергается, когда данные делают её крайне маловероятной. «Не отвергаем H₀» ≠ «H₀ верна» — мы лишь не нашли достаточных доказательств против. Принцип статистики: бремя доказательства лежит на H₁, как и «презумпция невиновности» в праве."
  },
  {
    "id": "statistics-inference-004",
    "course": "statistics",
    "topic": "inference",
    "level": "intermediate",
    "type": "choice",
    "concept": "p-значение — вероятность получить наблюдаемый результат (или более экстремальный) при условии, что H₀ верна.",
    "question": "Что такое p-значение?",
    "options": [
      "Вероятность того, что H₀ истинна",
      "Вероятность наблюдаемых данных при истинной H₀",
      "Вероятность ошибки исследователя",
      "Мощность статистического теста"
    ],
    "answer": 1,
    "explanation": "p-значение — это P(данные такие или хуже | H₀ верна). Малое p (< α=0.05) означает, что при истинной H₀ такие данные крайне редки, поэтому H₀ отвергается. Большое p — лишь нехватка доказательств, не подтверждение H₀."
  },
  {
    "id": "statistics-inference-005",
    "course": "statistics",
    "topic": "inference",
    "level": "intermediate",
    "type": "fill",
    "concept": "Ошибка I рода (α): отвергнуть верную H₀ (ложная тревога). Ошибка II рода (β): не отвергнуть ложную H₀ (пропустить эффект). Снижение α увеличивает β при фиксированном n.",
    "question": "Ошибка I рода — это отвержение ___ нулевой гипотезы.",
    "options": ["верной", "ложной", "незначимой", "проверяемой"],
    "answer": 0,
    "explanation": "Ошибка I рода: сказали «есть эффект», а его нет (false positive). Ошибка II рода: сказали «нет эффекта», а он есть (false negative). Между ними компромисс: строже порог α → реже ложные тревоги, но чаще пропускаем реальные эффекты."
  },
  {
    "id": "statistics-inference-006",
    "course": "statistics",
    "topic": "inference",
    "level": "intermediate",
    "type": "concept",
    "concept": "t-тест Стьюдента проверяет гипотезу о среднем, когда σ неизвестна и оценивается через s. Использует t-распределение с n-1 степенями свободы, у которого тяжелее хвосты, чем у нормального.",
    "question": "Когда применяют t-тест вместо z-теста?",
    "explanation": "z-тест требует знания σ или большой выборки (n≥30). t-тест применяется при малом n (n<30) и неизвестной σ. При увеличении степеней свободы t-распределение сходится к нормальному. При n→∞ разница между t- и z-тестом исчезает."
  },
  {
    "id": "statistics-inference-007",
    "course": "statistics",
    "topic": "inference",
    "level": "intermediate",
    "type": "output",
    "concept": "z-статистика для одновыборочного теста: z = (x̄ - μ₀) / (σ / √n). Стандартная ошибка SE = σ / √n показывает разброс выборочных средних.",
    "code": "x_bar, mu, sigma, n = 52, 50, 10, 100\nz = (x_bar - mu) / (sigma / n**0.5)\nprint(z)",
    "question": "Что выведет программа?",
    "options": ["0.2", "1.0", "2.0", "20.0"],
    "answer": 2,
    "expected_output": "2.0",
    "explanation": "SE = σ/√n = 10/√100 = 1. z = (52-50)/1 = 2.0. При z=2 p-значение ≈ 0.046 < 0.05 — H₀ (μ=50) отвергается на уровне 5%. Выборочное среднее 52 отстоит от 50 ровно на 2 стандартные ошибки."
  },
  {
    "id": "statistics-inference-008",
    "course": "statistics",
    "topic": "inference",
    "level": "intermediate",
    "type": "choice",
    "concept": "Критерий хи-квадрат (χ²) применяется к категориальным данным: проверяет согласие распределения с ожидаемым или независимость двух категориальных переменных.",
    "question": "Для чего применяется критерий хи-квадрат?",
    "options": [
      "Сравнение средних двух групп",
      "Проверка нормальности непрерывных данных",
      "Проверка независимости категориальных переменных",
      "Оценка коэффициентов линейной регрессии"
    ],
    "answer": 2,
    "explanation": "χ² сравнивает наблюдаемые и ожидаемые частоты категорий. Применения: таблицы сопряжённости (связь пола и предпочтений), тест согласия (соответствие эмпирического распределения теоретическому). Для сравнения средних используют t-тест или ANOVA."
  },
  {
    "id": "statistics-inference-009",
    "course": "statistics",
    "topic": "inference",
    "level": "beginner",
    "type": "concept",
    "concept": "Корреляция Пирсона r измеряет силу и направление линейной связи между двумя непрерывными переменными. r=+1: идеальная положительная, r=-1: идеальная отрицательная, r=0: нет линейной связи.",
    "question": "Что показывает корреляция и почему она не означает причинность?",
    "explanation": "Корреляция фиксирует совместное изменение переменных, но не причинно-следственную связь. Продажи мороженого и утопания коррелируют — оба растут летом из-за жары (скрытая третья переменная). Причинность устанавливается только через рандомизированный эксперимент."
  },
  {
    "id": "statistics-inference-010",
    "course": "statistics",
    "topic": "inference",
    "level": "beginner",
    "type": "fill",
    "concept": "Коэффициент корреляции Пирсона безразмерен и ограничен фиксированным диапазоном, что делает его сравнимым для разных пар переменных.",
    "question": "Коэффициент корреляции Пирсона r принимает значения от ___ до +1.",
    "options": ["-1", "0", "-∞", "-2"],
    "answer": 0,
    "explanation": "r ∈ [-1, 1]. Отрицательные значения — обратная связь. r² — коэффициент детерминации: показывает долю дисперсии Y, объяснённую X. Например, r=0.8 → R²=0.64: переменная X объясняет 64% вариации Y."
  },
  {
    "id": "statistics-inference-011",
    "course": "statistics",
    "topic": "inference",
    "level": "intermediate",
    "type": "concept",
    "concept": "Линейная регрессия МНК (OLS) находит прямую ŷ = β₀ + β₁x, минимизируя сумму квадратов остатков Σ(yᵢ - ŷᵢ)². β₁ — наклон, β₀ — свободный член.",
    "question": "Что минимизирует метод наименьших квадратов и почему именно квадраты?",
    "explanation": "МНК минимизирует SSE = Σ(yᵢ - ŷᵢ)². Квадрат нужен, чтобы положительные и отрицательные отклонения не компенсировали друг друга, и чтобы функция была дифференцируемой. Решение: β = (XᵀX)⁻¹Xᵀy. Допущения: линейность, гомоскедастичность, независимость остатков."
  }
]
