[
  {
    "id": "logic-quantifiers-001",
    "course": "logic",
    "topic": "quantifiers",
    "level": "beginner",
    "type": "concept",
    "concept": "Квантор всеобщности ∀ утверждает, что свойство выполняется у всех элементов рассматриваемой области.",
    "question": "Как читается и что означает запись ∀x P(x)?",
    "explanation": "∀x P(x) читается «для всякого x верно P(x)» и означает, что свойство P выполняется у ВСЕХ элементов области. Чтобы опровергнуть ∀x P(x), достаточно найти один контрпример — элемент, у которого P(x) ложно."
  },
  {
    "id": "logic-quantifiers-002",
    "course": "logic",
    "topic": "quantifiers",
    "level": "beginner",
    "type": "concept",
    "concept": "Квантор существования ∃ утверждает, что хотя бы у одного элемента области выполняется свойство.",
    "question": "Как читается и что означает запись ∃x P(x)?",
    "explanation": "∃x P(x) читается «существует x, для которого верно P(x)» и означает, что хотя бы ОДИН элемент области обладает свойством P. Чтобы доказать ∃x P(x), достаточно предъявить один такой элемент; чтобы опровергнуть — показать, что P(x) ложно для всех."
  },
  {
    "id": "logic-quantifiers-003",
    "course": "logic",
    "topic": "quantifiers",
    "level": "intermediate",
    "type": "choice",
    "concept": "Отрицание квантора меняет ∀ на ∃ (и наоборот) и заносится под квантор к самому свойству.",
    "question": "Чему равносильно ¬(∀x P(x))?",
    "options": ["∃x ¬P(x)", "∀x ¬P(x)", "¬∃x P(x)", "∀x P(x)"],
    "answer": 0,
    "explanation": "¬(∀x P(x)) ⇔ ∃x ¬P(x): «не для всех верно» = «есть хотя бы один, у которого не верно». Симметрично ¬(∃x P(x)) ⇔ ∀x ¬P(x): «нет ни одного» = «у всех не выполняется». Отрицание меняет квантор и уходит под него."
  },
  {
    "id": "logic-quantifiers-004",
    "course": "logic",
    "topic": "quantifiers",
    "level": "intermediate",
    "type": "choice",
    "concept": "Включение множеств записывается через квантор всеобщности с импликацией внутри.",
    "question": "Как записать A ⊆ B через квантор?",
    "options": [
      "∀x (x ∈ A → x ∈ B)",
      "∃x (x ∈ A ∧ x ∈ B)",
      "∀x (x ∈ A ∧ x ∈ B)",
      "∀x (x ∈ B → x ∈ A)"
    ],
    "answer": 0,
    "explanation": "A ⊆ B ⇔ ∀x (x ∈ A → x ∈ B): каждый элемент A обязан лежать в B. Внутри ∀ стоит импликация (→), а не конъюнкция: конъюнкция потребовала бы, чтобы КАЖДЫЙ x лежал и в A, и в B."
  }
]
