[
  {
    "id": "logic-connectives-001",
    "course": "logic",
    "topic": "connectives",
    "level": "beginner",
    "type": "concept",
    "concept": "Коммутативность связок ∧ и ∨ означает, что порядок операндов не влияет на результат.",
    "question": "Сформулируйте свойство коммутативности для «и» (∧) и «или» (∨).",
    "explanation": "A ∧ B ⇔ B ∧ A и A ∨ B ⇔ B ∨ A — порядок операндов не важен. Для множеств отсюда напрямую следует M ∩ C = C ∩ M и M ∪ C = C ∪ M, поэтому «математик среди шахматистов» и «шахматист среди математиков» задают одно множество."
  },
  {
    "id": "logic-connectives-002",
    "course": "logic",
    "topic": "connectives",
    "level": "beginner",
    "type": "concept",
    "concept": "Ассоциативность связок ∧ и ∨ означает, что при одной и той же связке расстановка скобок не влияет на результат.",
    "question": "Сформулируйте свойство ассоциативности для ∧ и ∨.",
    "explanation": "(A ∧ B) ∧ C ⇔ A ∧ (B ∧ C) и (A ∨ B) ∨ C ⇔ A ∨ (B ∨ C). При одной и той же связке скобки не важны, поэтому можно писать A ∧ B ∧ C без скобок. Важно: смешивать ∧ и ∨ без скобок нельзя — тогда порядок определяется дистрибутивностью."
  },
  {
    "id": "logic-connectives-003",
    "course": "logic",
    "topic": "connectives",
    "level": "intermediate",
    "type": "choice",
    "concept": "Дистрибутивность связывает ∧ и ∨: конъюнкция раскрывается по дизъюнкции подобно тому, как умножение раскрывается по сложению.",
    "question": "Чему равно A ∧ (B ∨ C) по закону дистрибутивности?",
    "options": [
      "(A ∧ B) ∨ (A ∧ C)",
      "(A ∨ B) ∧ (A ∨ C)",
      "(A ∧ B) ∧ (A ∧ C)",
      "A ∧ B ∧ C"
    ],
    "answer": 0,
    "explanation": "A ∧ (B ∨ C) ⇔ (A ∧ B) ∨ (A ∧ C) — конъюнкция «раскрывается» по дизъюнкции. Симметрично A ∨ (B ∧ C) ⇔ (A ∨ B) ∧ (A ∨ C). Для множеств: A ∩ (B ∪ C) = (A ∩ B) ∪ (A ∩ C)."
  },
  {
    "id": "logic-connectives-004",
    "course": "logic",
    "topic": "connectives",
    "level": "intermediate",
    "type": "choice",
    "concept": "Законы де Моргана описывают, как отрицание проходит внутрь конъюнкции и дизъюнкции, переворачивая связку.",
    "question": "Чему равносильно ¬(A ∧ B) по закону де Моргана?",
    "options": ["¬A ∨ ¬B", "¬A ∧ ¬B", "¬A → ¬B", "A ∨ B"],
    "answer": 0,
    "explanation": "¬(A ∧ B) ⇔ ¬A ∨ ¬B: отрицание заносится внутрь и «переворачивает» связку — ∧ становится ∨. Симметрично ¬(A ∨ B) ⇔ ¬A ∧ ¬B. Это ключ к отрицанию сложных условий."
  },
  {
    "id": "logic-connectives-005",
    "course": "logic",
    "topic": "connectives",
    "level": "intermediate",
    "type": "concept",
    "concept": "Законы де Моргана для множеств — прямой перенос логических законов: дополнение переворачивает пересечение и объединение.",
    "question": "Запишите законы де Моргана для множеств (дополнение пересечения и объединения).",
    "explanation": "(A ∩ B)̄ = Ā ∪ B̄ и (A ∪ B)̄ = Ā ∩ B̄. Дополнение переворачивает операцию: пересечение ↔ объединение. Это тот же закон де Моргана, что в логике, потому что ∩ соответствует ∧, ∪ соответствует ∨, а дополнение — отрицанию ¬."
  },
  {
    "id": "logic-connectives-006",
    "course": "logic",
    "topic": "connectives",
    "level": "intermediate",
    "type": "choice",
    "concept": "Импликация A → B ложна ровно в одном случае из четырёх; во всех остальных, включая ложную посылку, она истинна.",
    "question": "В каком единственном случае импликация A → B ложна?",
    "options": [
      "A истинно, B ложно",
      "A ложно, B истинно",
      "A ложно, B ложно",
      "A истинно, B истинно"
    ],
    "answer": 0,
    "explanation": "A → B ложна ТОЛЬКО когда посылка A истинна, а следствие B ложно. Во всех остальных случаях импликация истинна — в частности, при ложном A она истинна всегда («из лжи следует что угодно»). Это главный источник ошибок при работе с ∀."
  },
  {
    "id": "logic-connectives-007",
    "course": "logic",
    "topic": "connectives",
    "level": "intermediate",
    "type": "choice",
    "concept": "Импликацию можно выразить через дизъюнкцию и отрицание, что удобно при упрощении и отрицании формул.",
    "question": "Чему равносильна импликация A → B через ∨ и ¬?",
    "options": ["¬A ∨ B", "A ∨ ¬B", "¬A ∧ B", "A ∧ ¬B"],
    "answer": 0,
    "explanation": "A → B ⇔ ¬A ∨ B. Проверка по таблице: выражение ложно лишь когда ¬A ложно (то есть A истинно) и B ложно — ровно тот единственный случай, когда ложна импликация. Эта форма нужна, чтобы отрицать импликацию: ¬(A → B) ⇔ A ∧ ¬B."
  },
  {
    "id": "logic-connectives-008",
    "course": "logic",
    "topic": "connectives",
    "level": "intermediate",
    "type": "concept",
    "concept": "Контрапозиция утверждает равносильность прямой импликации и импликации из отрицания следствия в отрицание посылки.",
    "question": "Сформулируйте закон контрапозиции для импликации.",
    "explanation": "(A → B) ⇔ (¬B → ¬A). «Если дождь, то мокро» равносильно «если сухо (не мокро), то дождя не было». Прямая и контрапозитивная импликации всегда истинны или ложны одновременно, поэтому доказательство контрапозиции доказывает и исходное утверждение."
  }
]
