[
  {
    "id": "logic-formalization-001",
    "course": "logic",
    "topic": "formalization",
    "level": "intermediate",
    "type": "concept",
    "concept": "Выражение вида «самый X среди Y» формализуется парой: множество, из которого выбираем, и функция, по которой берём максимум.",
    "question": "Из каких двух частей состоит формальная структура выражения «самый X среди Y»?",
    "explanation": "Это пара (множество, функция): 1) множество Y — из кого выбираем; 2) функция X — критерий, по которому берём максимум. Два таких выражения дают один и тот же ответ тогда и только тогда, когда совпадают И множество Y, И функция X. Сначала выпиши обе части, потом сравнивай."
  },
  {
    "id": "logic-formalization-002",
    "course": "logic",
    "topic": "formalization",
    "level": "beginner",
    "type": "choice",
    "concept": "Оборот «X среди Y» задаёт пересечение двух множеств: тех, кто обладает обоими свойствами.",
    "question": "Каким множеством формализуется «математик среди шахматистов» (M — математики, C — шахматисты)?",
    "options": ["M ∩ C", "M ∪ C", "M \\ C", "C \\ M"],
    "answer": 0,
    "explanation": "M ∩ C — люди, которые одновременно и математики, и шахматисты (пересечение = оба свойства сразу). Порядок слов не важен: M ∩ C = C ∩ M в силу коммутативности пересечения, поэтому «шахматист среди математиков» — то же множество."
  },
  {
    "id": "logic-formalization-003",
    "course": "logic",
    "topic": "formalization",
    "level": "beginner",
    "type": "choice",
    "concept": "Оборот «все A, кроме B» задаёт разность множеств.",
    "question": "Каким множеством формализуется «все A, кроме B»?",
    "options": ["A \\ B", "B \\ A", "A ∩ B", "A ∪ B"],
    "answer": 0,
    "explanation": "A \\ B (разность): берём элементы A и исключаем те, что попали в B, то есть x ∈ A и x ∉ B. Обратная разность B \\ A означала бы «все B, кроме A» — другое множество."
  },
  {
    "id": "logic-formalization-004",
    "course": "logic",
    "topic": "formalization",
    "level": "intermediate",
    "type": "choice",
    "concept": "Утверждение «хотя бы один элемент A обладает свойством P» формализуется квантором существования с конъюнкцией внутри.",
    "question": "Как формализовать «хотя бы один элемент A обладает свойством P»?",
    "options": [
      "∃x (x ∈ A ∧ P(x))",
      "∀x (x ∈ A → P(x))",
      "∃x (x ∈ A → P(x))",
      "∀x (x ∈ A ∧ P(x))"
    ],
    "answer": 0,
    "explanation": "∃x (x ∈ A ∧ P(x)): существует x, который И лежит в A, И обладает P. Внутри ∃ ставится конъюнкция (∧). Импликация внутри ∃ была бы ошибкой: ∃x (x ∈ A → P(x)) истинно, даже если взять любой x вне A (ложная посылка делает импликацию истинной)."
  },
  {
    "id": "logic-formalization-005",
    "course": "logic",
    "topic": "formalization",
    "level": "intermediate",
    "type": "choice",
    "concept": "Утверждение «каждый элемент A обладает свойством P» формализуется квантором всеобщности с импликацией внутри. Замена → на ∧ — классическая ошибка.",
    "question": "Как формализовать «каждый элемент A обладает свойством P»?",
    "options": [
      "∀x (x ∈ A → P(x))",
      "∀x (x ∈ A ∧ P(x))",
      "∃x (x ∈ A ∧ P(x))",
      "∀x (P(x) → x ∈ A)"
    ],
    "answer": 0,
    "explanation": "∀x (x ∈ A → P(x)): для всякого x, если он лежит в A, то обладает P. Классическая ошибка — поставить ∧ вместо →: ∀x (x ∈ A ∧ P(x)) означало бы, что вообще всякий x лежит в A и обладает P, то есть весь универсум совпадает с A. Правило: внутри ∀ — импликация (→), внутри ∃ — конъюнкция (∧)."
  },
  {
    "id": "logic-formalization-006",
    "course": "logic",
    "topic": "formalization",
    "level": "intermediate",
    "type": "choice",
    "concept": "Утверждение «ни один элемент A не обладает свойством P» — это всеобщность отрицания свойства при импликации внутри.",
    "question": "Как формализовать «ни один элемент A не обладает свойством P»?",
    "options": [
      "∀x (x ∈ A → ¬P(x))",
      "∃x (x ∈ A ∧ ¬P(x))",
      "∀x (x ∈ A ∧ ¬P(x))",
      "∃x (x ∈ A → ¬P(x))"
    ],
    "answer": 0,
    "explanation": "∀x (x ∈ A → ¬P(x)): для всякого элемента A свойство P не выполняется. Это равносильно ¬∃x (x ∈ A ∧ P(x)) по закону отрицания квантора («нет ни одного A со свойством P»). Внутри ∀ снова импликация."
  },
  {
    "id": "logic-formalization-007",
    "course": "logic",
    "topic": "formalization",
    "level": "beginner",
    "type": "fill",
    "concept": "Непересечение множеств формально записывается через равенство их пересечения пустому множеству.",
    "question": "«Множества A и B не пересекаются» ⇔ A ∩ B = ___. Что на месте пропуска?",
    "options": ["∅", "A ∪ B", "A", "универсум"],
    "answer": 0,
    "explanation": "A ∩ B = ∅. Непересекающиеся (дизъюнктные) множества не имеют ни одного общего элемента, поэтому их пересечение пусто. Это стандартная формальная запись условия «нет общих элементов»."
  }
]
