[
  {
    "id": "logic-sets-001",
    "course": "logic",
    "topic": "sets",
    "level": "beginner",
    "type": "fill",
    "concept": "Пересечение множеств A ∩ B состоит из элементов, принадлежащих обоим множествам одновременно. По определению это конъюнкция двух условий.",
    "question": "x ∈ A ∩ B ⇔ (x ∈ A ___ x ∈ B). Какая связка на месте пропуска?",
    "options": ["и", "или", "влечёт", "не"],
    "answer": 0,
    "explanation": "Пересечение — это конъюнкция: x ∈ A ∩ B означает x ∈ A И x ∈ B одновременно. Оба условия должны выполняться. Если хотя бы одно ложно, элемент в пересечение не входит."
  },
  {
    "id": "logic-sets-002",
    "course": "logic",
    "topic": "sets",
    "level": "beginner",
    "type": "fill",
    "concept": "Объединение множеств A ∪ B состоит из элементов, принадлежащих хотя бы одному из множеств. По определению это дизъюнкция.",
    "question": "x ∈ A ∪ B ⇔ (x ∈ A ___ x ∈ B). Какая связка на месте пропуска?",
    "options": ["или", "и", "не", "тогда и только тогда"],
    "answer": 0,
    "explanation": "Объединение — это дизъюнкция: достаточно, чтобы выполнялось хотя бы одно из условий. «Или» здесь не исключающее — элемент может лежать и в A, и в B одновременно, он всё равно попадает в объединение."
  },
  {
    "id": "logic-sets-003",
    "course": "logic",
    "topic": "sets",
    "level": "beginner",
    "type": "fill",
    "concept": "Разность множеств A \\ B состоит из элементов, которые есть в A, но которых нет в B. По определению это конъюнкция условия принадлежности и условия непринадлежности.",
    "question": "x ∈ A \\ B ⇔ (x ∈ A ___ x ∉ B). Какая связка на месте пропуска?",
    "options": ["и", "или", "влечёт", "не"],
    "answer": 0,
    "explanation": "Разность = «в первом есть, во втором нет»: x ∈ A И x ∉ B одновременно. Это конъюнкция принадлежности A и непринадлежности B."
  },
  {
    "id": "logic-sets-004",
    "course": "logic",
    "topic": "sets",
    "level": "beginner",
    "type": "choice",
    "concept": "Подмножество A ⊆ B означает, что каждый элемент A лежит и в B. Формально это квантор всеобщности с импликацией внутри.",
    "question": "Как раскрывается определение A ⊆ B?",
    "options": [
      "∀x (x ∈ A → x ∈ B)",
      "∃x (x ∈ A ∧ x ∈ B)",
      "∀x (x ∈ A ∧ x ∈ B)",
      "∀x (x ∈ B → x ∈ A)"
    ],
    "answer": 0,
    "explanation": "A ⊆ B ⇔ ∀x (x ∈ A → x ∈ B): для всякого x, если x лежит в A, то он лежит и в B. Вариант с ∧ означал бы, что всякий x лежит и в A, и в B (то есть весь универсум входит в оба). Вариант с обратной импликацией — это B ⊆ A."
  },
  {
    "id": "logic-sets-005",
    "course": "logic",
    "topic": "sets",
    "level": "beginner",
    "type": "concept",
    "concept": "Равенство множеств определяется через взаимное включение: A = B тогда и только тогда, когда A ⊆ B и B ⊆ A.",
    "question": "Что по определению означает равенство двух множеств A = B и как его доказывают?",
    "explanation": "A = B ⇔ (A ⊆ B и B ⊆ A). Равенство множеств — это взаимное включение, поэтому его доказывают в две стороны: сначала берут произвольный x ∈ A и показывают x ∈ B, затем наоборот. Оба включения вместе дают совпадение множеств."
  },
  {
    "id": "logic-sets-006",
    "course": "logic",
    "topic": "sets",
    "level": "beginner",
    "type": "fill",
    "concept": "Дополнение Ā — это все элементы универсума, которые не принадлежат A. По определению принадлежность дополнению равносильна непринадлежности самому множеству.",
    "question": "x ∈ Ā (дополнение A) ⇔ x ___ A. Какой знак на месте пропуска?",
    "options": ["∉", "∈", "⊆", "="],
    "answer": 0,
    "explanation": "Дополнение Ā содержит всё, что НЕ лежит в A (в рамках рассматриваемого универсума). Поэтому x ∈ Ā ⇔ x ∉ A. Дополнение переводит принадлежность в отрицание принадлежности."
  },
  {
    "id": "logic-sets-007",
    "course": "logic",
    "topic": "sets",
    "level": "beginner",
    "type": "concept",
    "concept": "Пустое множество ∅ — это множество, не содержащее ни одного элемента. Оно является подмножеством любого множества.",
    "question": "Что такое пустое множество ∅?",
    "explanation": "∅ — множество без элементов. Для любого x утверждение x ∈ ∅ ложно. Отсюда ∅ ⊆ B для любого B (импликация x ∈ ∅ → x ∈ B истинна пусто, так как посылка всегда ложна). Через ∅ удобно записывать, что множества не пересекаются: A ∩ B = ∅."
  }
]
