[
  {
    "id": "rust-lifetimes-001",
    "course": "rust",
    "topic": "lifetimes",
    "level": "beginner",
    "type": "concept",
    "concept": "Lifetime — аннотация, которая говорит компилятору, как долго живёт ссылка. Она не меняет время жизни значения, только описывает отношения между жизнями разных ссылок.",
    "question": "Что такое lifetime в Rust?",
    "explanation": "Lifetime — это область, в которой ссылка является действительной. Rust проверяет на этапе компиляции, что ссылка не переживёт значение, на которое указывает. Большинство lifetime выводятся автоматически (elision)."
  },
  {
    "id": "rust-lifetimes-002",
    "course": "rust",
    "topic": "lifetimes",
    "level": "beginner",
    "type": "compiles",
    "concept": "Аннотация lifetime записывается как 'a. Она говорит: возвращаемая ссылка живёт не дольше, чем оба аргумента.",
    "code": "fn longest<'a>(x: &'a str, y: &'a str) -> &'a str {\n    if x.len() > y.len() { x } else { y }\n}\nfn main() {\n    let s1 = String::from(\"long\");\n    let result;\n    {\n        let s2 = String::from(\"xy\");\n        result = longest(s1.as_str(), s2.as_str());\n        println!(\"{}\", result);\n    }\n}",
    "question": "Скомпилируется ли этот код?",
    "options": ["Да", "Нет"],
    "answer": 0,
    "expected": "compiles",
    "explanation": "Да. result используется внутри внутреннего блока, где s2 ещё живёт. Lifetime 'a = min(lifetime s1, lifetime s2). println! находится до выхода s2 из области — всё ок."
  },
  {
    "id": "rust-lifetimes-003",
    "course": "rust",
    "topic": "lifetimes",
    "level": "intermediate",
    "type": "compiles",
    "concept": "Lifetime возвращаемой ссылки должно быть не больше, чем время жизни источника. Если result живёт дольше s2, компилятор откажет.",
    "code": "fn longest<'a>(x: &'a str, y: &'a str) -> &'a str {\n    if x.len() > y.len() { x } else { y }\n}\nfn main() {\n    let s1 = String::from(\"long\");\n    let result;\n    {\n        let s2 = String::from(\"xy\");\n        result = longest(s1.as_str(), s2.as_str());\n    }\n    println!(\"{}\", result);\n}",
    "question": "Скомпилируется ли этот код?",
    "options": ["Да", "Нет"],
    "answer": 1,
    "expected": "fails",
    "explanation": "Нет. result используется вне блока, где живёт s2. Lifetime 'a = min(s1, s2) = s2. result переживает s2. Ошибка: `error[E0597]: `s2` does not live long enough`."
  },
  {
    "id": "rust-lifetimes-004",
    "course": "rust",
    "topic": "lifetimes",
    "level": "intermediate",
    "type": "concept",
    "concept": "Lifetime elision rules: 1) каждый &-параметр получает свой lifetime; 2) если один входной — применяется к output; 3) если один из входных &self — его lifetime применяется к output.",
    "question": "Зачем нужны правила lifetime elision?",
    "explanation": "Elision rules позволяют не писать lifetime в очевидных случаях. Компилятор выводит их сам. Правила: 1) каждый &-параметр получает свой lifetime; 2) единственный входной заполняет output; 3) &self заполняет output в методах."
  },
  {
    "id": "rust-lifetimes-005",
    "course": "rust",
    "topic": "lifetimes",
    "level": "intermediate",
    "type": "compiles",
    "concept": "'static lifetime — значение живёт всю программу. Строковые литералы &str имеют тип &'static str — они хранятся в сегменте данных бинарника.",
    "code": "fn get_str() -> &'static str {\n    \"hello\"\n}\nfn main() {\n    let s = get_str();\n    println!(\"{}\", s);\n}",
    "question": "Скомпилируется ли этот код?",
    "options": ["Да", "Нет"],
    "answer": 0,
    "expected": "compiles",
    "explanation": "Да. \"hello\" — строковый литерал &'static str. Он хранится в read-only сегменте бинарника и живёт всю программу. Вывод: hello."
  },
  {
    "id": "rust-lifetimes-006",
    "course": "rust",
    "topic": "lifetimes",
    "level": "advanced",
    "type": "compiles",
    "concept": "Lifetime в структуре говорит: фиель ссылки не переживёт структуру. Без аннотации компилятор не знает, какой lifetime у ссылки.",
    "code": "struct Important<'a> {\n    part: &'a str,\n}\nfn main() {\n    let text = String::from(\"long text here\");\n    let i = Important { part: text.as_str() };\n    println!(\"{}\", i.part);\n}",
    "question": "Скомпилируется ли этот код?",
    "options": ["Да", "Нет"],
    "answer": 0,
    "expected": "compiles",
    "explanation": "Да. Important<'a> объявляет: объект не переживёт ссылку, на которую указывает part. text живёт дольше i, поэтому всё корректно. Вывод: long text here."
  },
  {
    "id": "rust-lifetimes-007",
    "course": "rust",
    "topic": "lifetimes",
    "level": "advanced",
    "type": "compiles",
    "concept": "Higher-ranked trait bounds (HRTB) `for<'a>` позволяют описывать трейты, работающие с любым lifetime — чаще всего для замыканий.",
    "code": "fn apply<F>(f: F, s: &str) -> usize\nwhere\n    F: for<'a> Fn(&'a str) -> usize,\n{\n    f(s)\n}\nfn main() {\n    let n = apply(|s| s.len(), \"hello\");\n    println!(\"{}\", n);\n}",
    "question": "Скомпилируется ли этот код?",
    "options": ["Да", "Нет"],
    "answer": 0,
    "expected": "compiles",
    "explanation": "Да. `for<'a> Fn(&'a str) -> usize` — HRTB, означает «для любого lifetime 'a». Замыкание |s| s.len() удовлетворяет этому. Вывод: 5."
  },
  {
    "id": "rust-lifetimes-008",
    "course": "rust",
    "topic": "lifetimes",
    "level": "advanced",
    "type": "choice",
    "concept": "Variance в Rust: covariant (длинный lifetime принимается вместо короткого), invariant (&mut T — нельзя заменять lifetime).",
    "question": "Какой lifetime допустим в &'a str, если требуется &'short str?",
    "options": ["Только точно такой же", "Любой lifetime дольше short", "Любой lifetime короче short", "Никакой"],
    "answer": 1,
    "explanation": "&'a str ковариантен по lifetime. Переменную типа &'long str можно передать туда, где ожидается &'short str, так как долгая ссылка удовлетворяет короткому требованию. Обратное неверно."
  },
  {
    "id": "rust-lifetimes-009",
    "course": "rust",
    "topic": "lifetimes",
    "level": "advanced",
    "type": "concept",
    "concept": "HRTB (Higher-Ranked Trait Bounds) — `for<'a>` означает «для ЛЮБОГО lifetime 'a», тогда как обычный `<'a>` означает «для ОДНОГО конкретного lifetime, который выбирает вызывающая сторона». HRTB нужен, когда функция или замыкание должны работать с ссылками произвольной длины жизни — в том числе с временными ссылками, создаваемыми внутри тела функции.",
    "question": "Чем `for<'a> Fn(&'a str)` отличается от `Fn(&'a str)` с обычным параметром `'a`?",
    "explanation": "С обычным `<'a>` вызывающая сторона выбирает конкретный lifetime — замыкание работает только с ссылками этой длины жизни. С `for<'a>` замыкание обязано работать с ссылками ЛЮБОЙ длины жизни, включая очень короткие (например, ссылки на временные значения внутри функции). Мысленная модель: обычный `'a` — «выбери lifetime заранее», `for<'a>` — «должно работать для всех возможных lifetime». На практике большинство замыканий вида `|s: &str| s.len()` автоматически выводятся компилятором как HRTB — писать `for<'a>` вручную приходится редко, в основном при работе с trait-объектами: `Box<dyn for<'a> Fn(&'a str) -> usize>`."
  },
  {
    "id": "rust-lifetimes-010",
    "course": "rust",
    "topic": "lifetimes",
    "level": "advanced",
    "type": "choice",
    "concept": "Когда нужно принять замыкание, которое должно работать с ссылкой любой длины жизни (в том числе созданной внутри функции), обычного параметра `'a` недостаточно — нужен HRTB.",
    "question": "Какое ограничение корректно выражает «замыкание F принимает &str с ЛЮБЫМ lifetime»?",
    "options": [
      "F: Fn(&'static str) -> usize",
      "F: for<'a> Fn(&'a str) -> usize",
      "F: Fn<'a>(&'a str) -> usize",
      "F: Fn(&str) -> usize где 'a: 'static"
    ],
    "answer": 1,
    "explanation": "`for<'a> Fn(&'a str) -> usize` — HRTB: компилятор проверяет, что F работает для всех возможных lifetimes 'a. Вариант с `&'static str` ограничивает только статическими строками. Синтаксис `Fn<'a>(...)` неверный. Четвёртый вариант бессмысленен: `'a: 'static` нет в сигнатуре F."
  }
]
